{"deploymentFiles":{"flake.nix":"53b5d29f8fad4b66befbb66c8fc84dc993885893f0657ae147269dee7648c6b7","nix/module.nix":"2961b29887f59d6bea860e7312d843366ed645ed447232577716b784f30ff7c6","package.json":"0dd5eaa3e1166608ef21a3a6c33a86461e15adba06f632c7fc92a0cf11bddd6a","schema/portability-receipt.schema.json":"81f1edabc237263db12b0773f04777447449319b58253602f7c487c50e5ba972","schema/portable-state.schema.json":"a7702c2cb520f8dead1a648679f881c92843f7fb93103d5ff23aacc06dca15c6","src/cli.js":"68a0acb672e08f18e78fe033365aaabb221873348f4f75614bf90944accf6c08","src/core.js":"35db01f795316a31cea5ff3fae2f84ba6e09a49da6334d7828c49d861209b038","src/portability.js":"171a4c988478b167d47386d3cd85d17acffc396eab893850417480a37db0c65b","src/server.js":"74ae9136ee13113215159fde6ae9efe69fc0bd6e7b0e4944a620c08c069debac"},"format":"npt-portability-receipt","service":"org.nexope.nex-portability-test.reference-service","verification":{"bundleSha256":"d561fe356c159d549704fd1f250dd85356a671ab5382464824dc78b6452aaaa7","deterministicExport":true,"roundTripEqual":true,"schemaValidated":true},"version":"1.0"}
